<?xml version="1.0" encoding="UTF-8"?>
<!--
	
    
	Definition of properties and predefined options for Hitro-UI.
	
	A dynamic object model is generated based on the definitions 
	in this file and the necessary GUI forms created to allow 
	selection of or entering data.
	
	Concrete selections or values entered by the user will be saved in the 
	database.
	
    Author:  <koderman@sernet.de>
-->

<!--
Template:

<huientity
    name=""
    id="">
    <huiproperty
        name=""
        id=""/>
</huientity>

-->

<huientities
	xmlns="http://www.sernet.de/hitro"
	xmlns:xsi="http://www.w3.org/2001/XMLSchema-instance"
	xsi:schemaLocation="http://www.sernet.de/hitro hitro.xsd">

 <huientity
        name="Raum"
        id="raum">
        <huiproperty
            name="Kürzel"
            id="raum_kuerzel"
            focus="true" >
             <defaultRule class="SimpleValue">
                	<param>R-</param>
                </defaultRule>
        </huiproperty>
        <huiproperty
            name="Name"
            id="raum_name" />

        <huiproperty
            id="raum_tag"
            name="Tags"
            tooltip="Liste von Tags, getrennt durch Komma oder Leerzeichen"
        />
        
        <huiproperty
            name="Anzahl"
            id="raum_anzahl" />
        <huiproperty
            name="Erläuterung"
            inputtype="text"
            id="raum_erlaeuterung" />
            
        <huipropertygroup
			id="raum_group_schutzbedarf"
			name="Schutzbedarf">
			<huiproperty
				id="raum_vertraulichkeit"
				name="Vertraulichkeit"
				inputtype="singleoption">
				<option
					id="raum_vertraulichkeit_normal"
					name="Normal" />
				<option
					id="raum_vertraulichkeit_hoch"
					name="Hoch" />
				<option
					id="raum_vertraulichkeit_sehrhoch"
					name="Sehr Hoch" />
			</huiproperty>
			<huiproperty
				id="raum_verfuegbarkeit"
				name="Verfügbarkeit"
				inputtype="singleoption">
				<option
					id="raum_verfuegbarkeit_normal"
					name="Normal" />
				<option
					id="raum_verfuegbarkeit_hoch"
					name="Hoch" />
				<option
					id="raum_verfuegbarkeit_sehrhoch"
					name="Sehr Hoch" />
			</huiproperty>
			<huiproperty
				id="raum_integritaet"
				name="Integrität"
				inputtype="singleoption">
				<option
					id="raum_integritaet_normal"
					name="Normal" />
				<option
					id="raum_integritaet_hoch"
					name="Hoch" />
				<option
					id="raum_integritaet_sehrhoch"
					name="Sehr Hoch" />
			</huiproperty>

			<huiproperty
				name="Begründung Vertraulichkeit"
				id="raum_vertraulichkeit_begruendung" />
			<huiproperty
				name="Begründung Verfügbarkeit"
				id="raum_verfuegbarkeit_begruendung" />
			<huiproperty
				name="Begründung Integrität"
				id="raum_integritaet_begruendung" />
				
			
		</huipropertygroup>
		
		<huipropertygroup 
			name="Managementbewertung" 
			id="raum_mgmtreview">
			<huiproperty 
				name="Erg. Sicherheitsanalyse" 
				id="raum_ergaenzendeanalyse"
				inputtype="singleoption">
				<option 
					id="raum_ergaenzendeanalyse_schutzbedarf" 
					name="lt. Schutzbedarf"/>
				<option 
					id="raum_ergaenzendeanalyse_modell" 
					name="zusätzlich vormerken"/>
			</huiproperty>
			
			<huiproperty 
				name="Risikoanalyse" 
				id="raum_risikoanalyse"
				inputtype="singleoption">
				<option 
					id="raum_risikoanalyse_noetig" 
					name="nötig"/>
				<option 
					id="raum_risikoanalyse_unnoetig" 
					name="entbehrlich"/>
			</huiproperty>
			
			<huiproperty 
				name="Begründung Mgmt" 
				id="raum_risikoanalyse_begruendung"
				inputtype="text"/>
			
		</huipropertygroup>
		
    </huientity>

 <huientity
        name="Server"
        id="server">
        <huiproperty
            name="Kürzel"
            id="server_kuerzel"
            focus="true" >
             <defaultRule class="SimpleValue">
                	<param>S-</param>
                </defaultRule>
        </huiproperty>
        <huiproperty
            name="Name"
            id="server_name" />

        <huiproperty
            id="server_tag"
            name="Tags"
            tooltip="Liste von Tags, getrennt durch Komma oder Leerzeichen"
        />

            
        <huiproperty
            name="Anzahl"
            id="server_anzahl" />
        <huiproperty
            name="Erläuterung"
            inputtype="text"
            id="server_erlaeuterung" />
        <huiproperty
            name="Plattform"
            id="server_plattform" />
        <huiproperty
            name="Aufstellungsort"
            id="server_aufstellungsort" />
        <huiproperty
            name="Status"
            id="server_status"
            inputtype="singleoption">
                <option
                    id="server_status_betrieb"
                    name="Betrieb" />
                <option
                    id="server_status_planung"
                    name="Planung" />
                <option
                    id="server_status_grundinstallation"
                    name="Grundinstallation" />
                <option
                    id="server_status_Konfiguration"
                    name="Konfiguration" />
                <option
                    id="server_status_test"
                    name="Test" />
                <option
                    id="server_status_auslieferung"
                    name="Auslieferung" />
                <option
                    name="Reparatur"
                    id="server_status_reparatur" />
                <option
                    name="Standby"
                    id="server_status_standby" />
                <option
                    name="Reserve"
                    id="server_status_reserve" />
        </huiproperty>
        <huiproperty
            name="Anwender"
            id="server_anwender" />
        <huiproperty
            name="Admin"
            id="server_admin" />
        <huiproperty
            name="Netzadressen"
            id="server_netadr" />
		<huipropertygroup
			id="server_group_schutzbedarf"
			name="Schutzbedarf">
			<huiproperty
				id="server_vertraulichkeit"
				name="Vertraulichkeit"
				inputtype="singleoption">
				<option
					id="server_vertraulichkeit_normal"
					name="Normal" />
				<option
					id="server_vertraulichkeit_hoch"
					name="Hoch" />
				<option
					id="server_vertraulichkeit_sehrhoch"
					name="Sehr Hoch" />
			</huiproperty>
			<huiproperty
				id="server_verfuegbarkeit"
				name="Verfügbarkeit"
				inputtype="singleoption">
				<option
					id="server_verfuegbarkeit_normal"
					name="Normal" />
				<option
					id="server_verfuegbarkeit_hoch"
					name="Hoch" />
				<option
					id="server_verfuegbarkeit_sehrhoch"
					name="Sehr Hoch" />
			</huiproperty>
			<huiproperty
				id="server_integritaet"
				name="Integrität"
				inputtype="singleoption">
				<option
					id="server_integritaet_normal"
					name="Normal" />
				<option
					id="server_integritaet_hoch"
					name="Hoch" />
				<option
					id="server_integritaet_sehrhoch"
					name="Sehr Hoch" />
			</huiproperty>

			<huiproperty
				name="Begründung Vertraulichkeit"
				id="server_vertraulichkeit_begruendung" />
			<huiproperty
				name="Begründung Verfügbarkeit"
				id="server_verfuegbarkeit_begruendung" />
			<huiproperty
				name="Begründung Integrität"
				id="server_integritaet_begruendung" />

		</huipropertygroup>        
		<huipropertygroup 
			name="Managementbewertung" 
			id="server_mgmtreview">
			<huiproperty 
				name="Erg. Sicherheitsanalyse" 
				id="server_ergaenzendeanalyse"
				inputtype="singleoption">
				<option 
					id="server_ergaenzendeanalyse_schutzbedarf" 
					name="lt. Schutzbedarf"/>
				<option 
					id="server_ergaenzendeanalyse_modell" 
					name="zusätzlich vormerken"/>
			</huiproperty>
			
			<huiproperty 
				name="Risikoanalyse" 
				id="server_risikoanalyse"
				inputtype="singleoption">
				<option 
					id="server_risikoanalyse_noetig" 
					name="nötig"/>
				<option 
					id="server_risikoanalyse_unnoetig" 
					name="entbehrlich"/>
			</huiproperty>
			
			<huiproperty 
				name="Begründung Mgmt" 
				id="server_risikoanalyse_begruendung"
				inputtype="text"/>
			
		</huipropertygroup>   
    </huientity>

    <huientity
        name="TK-Komponente"
        id="tkkomponente">
        <huiproperty
            name="Kürzel"
            id="tkkomponente_kuerzel"
            focus="true" >
             <defaultRule class="SimpleValue">
                	<param>TK-</param>
                </defaultRule>
        </huiproperty>
        <huiproperty
            name="Name"
            id="tkkomponente_name" />
            
        <huiproperty
            id="tkkomponente_tag"
            name="Tags"
            tooltip="Liste von Tags, getrennt durch Komma oder Leerzeichen"
        />

            
        <huiproperty
            name="Anzahl"
            id="tkkomponente_anzahl" />
        <huiproperty
            name="Erläuterung"
            inputtype="text"
            id="tkkomponente_erlaeuterung" />
        <huiproperty
            name="Plattform"
            id="tkkomponente_plattform" />
        <huiproperty
            name="Aufstellungsort"
            id="tkkomponente_aufstellungsort" />
        <huiproperty
            name="Status"
            id="tkkomponente_status"
            inputtype="singleoption">
                <option
                    id="tkkomponente_status_betrieb"
                    name="Betrieb" />
                <option
                    id="tkkomponente_status_planung"
                    name="Planung" />
                <option
                    id="tkkomponente_status_grundinstallation"
                    name="Grundinstallation" />
                <option
                    id="tkkomponente_status_Konfiguration"
                    name="Konfiguration" />
                <option
                    id="tkkomponente_status_test"
                    name="Test" />
                <option